### ISSUE TITLE
401 error

### ISSUE THREAD

**Issue by trezorg** [requests/requests-ntlm#61]
I am authentification against https://east.exch029.serverdata.net/EWS/Exchange.asmx server. I got 401 error. When I tried with curl --ntml then I've got 200 response.
What could be different in curl and requests_ntml NTLM protocol realization?
I can give additional information and creadentials if needed.

**Comment by Lukasa** [comment]
The most likely issue is surrounding connection pooling. Can you tell me what versions of requests and requests_ntlm you're using?

**Comment by trezorg** [comment]
requests==2.7.0
requests-ntlm==0.2.0

**Comment by Lukasa** [comment]
Hmm, that's weird. Are you familiar with tcpdump?

**Comment by trezorg** [comment]
I can start some simple command. I am not sure how to decode https session.

**Comment by Lukasa** [comment]
We don't need to decode the session, I just need to see how many TCP connections are created.

**Comment by trezorg** [comment]
This is output.
23:10:21.214700 IP 192.168.100.100.33306 > 199.193.200.203.443: Flags [S], seq 983701046, win 29200, options [mss 1460,sackOK,TS val 10704584 ecr 0,nop,wscale 7], length 0
23:10:21.398004 IP 199.193.200.203.443 > 192.168.100.100.33306: Flags [S.], seq 356261063, ack 983701047, win 8192, options [mss 1380], length 0
23:10:21.398098 IP 192.168.100.100.33306 > 199.193.200.203.443: Flags [.], ack 1, win 29200, length 0
23:10:21.409757 IP 192.168.100.100.33306 > 199.193.200.203.443: Flags [P.], seq 1:272, ack 1, win 29200, length 271
23:10:21.594903 IP 199.193.200.203.443 > 192.168.100.100.33306: Flags [.], seq 1:1381, ack 272, win 64860, length 1380
23:10:21.595046 IP 192.168.100.100.33306 > 199.193.200.203.443: Flags [.], ack 1381, win 31740, length 0
23:10:22.246666 IP 199.193.200.203.443 > 192.168.100.100.33306: Flags [P.], seq 1381:2618, ack 272, win 64860, length 1237
23:10:22.246790 IP 192.168.100.100.33306 > 199.193.200.203.443: Flags [.], ack 2618, win 34500, length 0
23:10:22.248608 IP 192.168.100.100.33306 > 199.193.200.203.443: Flags [P.], seq 272:630, ack 2618, win 34500, length 358
23:10:22.435689 IP 199.193.200.203.443 > 192.168.100.100.33306: Flags [P.], seq 2618:2709, ack 630, win 64502, length 91
23:10:22.436666 IP 192.168.100.100.33306 > 199.193.200.203.443: Flags [P.], seq 630:907, ack 2709, win 34500, length 277
23:10:22.620921 IP 199.193.200.203.443 > 192.168.100.100.33306: Flags [P.], seq 2709:3130, ack 907, win 64225, length 421
23:10:22.622677 IP 192.168.100.100.33306 > 199.193.200.203.443: Flags [P.], seq 907:1296, ack 3130, win 37260, length 389
23:10:22.805834 IP 199.193.200.203.443 > 192.168.100.100.33306: Flags [P.], seq 3130:3951, ack 1296, win 63836, length 821
23:10:22.837201 IP 192.168.100.100.33306 > 199.193.200.203.443: Flags [P.], seq 1296:1941, ack 3951, win 40020, length 645
23:10:23.021850 IP 199.193.200.203.443 > 192.168.100.100.33306: Flags [P.], seq 3951:4260, ack 1941, win 64860, length 309
23:10:23.026536 IP 192.168.100.100.33306 > 199.193.200.203.443: Flags [F.], seq 1941, ack 4260, win 42780, length 0
23:10:23.215106 IP 199.193.200.203.443 > 192.168.100.100.33306: Flags [F.], seq 4260, ack 1942, win 64860, length 0
23:10:23.215185 IP 192.168.100.100.33306 > 199.193.200.203.443: Flags [.], ack 4261, win 42780, length 0

**Comment by Lukasa** [comment]
Hmm that looks like an entirely reasonable flow. Do you have any backslashes in your username or password?

**Comment by trezorg** [comment]
There are no any backslashes at all. As far as I know there is Exchange 2010.

**Comment by trezorg** [comment]
I can provide code I use and test account credentials, if you are interested.

**Comment by Lukasa** [comment]
Hmm, that's not a bad idea, though it's hard for me to test at the moment (no access to a Windows machine).

**Comment by trezorg** [comment]
I also cannot provide rigth now, I  am not at computet, but as soon ad possible I will do.

**Comment by trezorg** [comment]
This is my code with requests_ntlm:

    import requests
    import logging
    from requests_ntlm import HttpNtlmAuth
    try:
        import http.client as http_client
    except ImportError:
        import httplib as http_client
    http_client.HTTPConnection.debuglevel = 1

    logging.basicConfig() 
    logging.getLogger().setLevel(logging.DEBUG)
    requests_log = logging.getLogger("requests.packages.urllib3")
    requests_log.setLevel(logging.DEBUG)
    requests_log.propagate = True
    auth = HttpNtlmAuth('moduleq.hostpilot.com\\ben', 'MQalpha01')
    response = requests.get('https://east.exch029.serverdata.net/EWS/Exchange.asmx', auth=auth)
    print response.text
    print response.status_code

This is curl example:

    curl -L -vv --ntlm -u ben@moduleq.hostpilot.com:MQalpha01 https://east.exch029.serverdata.net/EWS/Exchange.asmx    

Can you give me know when you have read it so that I could wipe out sencetive information? :)

**Comment by Lukasa** [comment]
I recommend you wipe out sensitive information right now, and mail it to me instead at <cory@lukasa.co.uk>. I won't get a chance to look at this for a few days.

**Comment by trezorg** [comment]
Thanks you. I sent email message.

**Comment by doomwomble** [comment]
Same here, authenticating to SharePoint 2019 on-prem. Updating to 1.2.0 breaks the authentication code, giving me an HTTP 401 and reverting to 1.1.0 fixes the issue.
